{
  "case_count": 40,
  "condition_id": "I3",
  "gate_results": {
    "execution_complete": true,
    "matched_budget": true,
    "preregistered_interpretation_passed": true,
    "single_factor_isolation": true
  },
  "group": "synthesis_integrity",
  "metrics": {
    "active_eligibility": 40,
    "behavioral_class_count": 15,
    "behavioral_equivalent_count": 25,
    "candidate_count": 40,
    "certification_pressure": 40,
    "firewall_detected": false,
    "harmful_noop_rate": 0.0,
    "missing_witness_promotions": 10,
    "operation_noncompliance": 4,
    "parameter_diversity": 0.14163636363636364,
    "phase4_case_count": 25000.0,
    "phase4_frr": 0.025160234556116188,
    "phase4_original_escalation": 0.26488,
    "phase4_residual_escalation": 0.09564,
    "phase4_rounds": 0.16924,
    "phase4_uar": 0.19179407780143218,
    "phase4_world_count": 500.0,
    "protected_error": 0.10095486111111111,
    "publication_allowed": true,
    "scope_leakage": 0.2421875,
    "semantic_class_count": 30,
    "semantic_duplicate_count": 10,
    "shared_active_basis": 0.0,
    "shared_active_basis_max": 2.0,
    "shared_additive_severity_use": 0.0,
    "shared_case_count": 384.0,
    "shared_closure_error": 0.0,
    "shared_false_rejection_count": 0.0,
    "shared_frr": 0.0,
    "shared_initial_unresolved": 352.0,
    "shared_irrelevant_activation": 64.0,
    "shared_local_resolution": 288.0,
    "shared_meta_signal_hard_veto": 0.0,
    "shared_oracle_access_count": 0.0,
    "shared_query_count": 0.6666666666666666,
    "shared_query_yield": 0.6666666666666666,
    "shared_residual_escalation": 0.16666666666666666,
    "shared_residual_escalation_count": 64.0,
    "shared_rounds": 0.9166666666666666,
    "shared_safe_total": 192.0,
    "shared_scope_leakage": 0.0,
    "shared_uar": 0.0,
    "shared_uncertified_composition_influence": 0.0,
    "shared_uncertified_terminal_count": 0.0,
    "shared_unsafe_acceptance_count": 0.0,
    "shared_unsafe_total": 192.0,
    "taint_count": 0,
    "template_count": 14,
    "valid_yield": 1.0,
    "witness_success": 0.75,
    "witnessed_yield": 0.75
  },
  "schema_version": "1.0.0",
  "status": "EXPECTED_DEGRADATION",
  "trace_hash": "d0d18e122a1b8c81d6f69bf888272f80f6b822118b31d570003cebdc9c929e3d"
}
