{
  "case_count": 384,
  "condition_id": "P14",
  "gate_results": {
    "execution_complete": true,
    "matched_budget": true,
    "preregistered_interpretation_passed": true,
    "single_factor_isolation": true
  },
  "group": "perception_closure_runtime",
  "metrics": {
    "active_basis": 0.0,
    "active_basis_max": 2.0,
    "additive_severity_use": 0.0,
    "case_count": 384.0,
    "closure_error": 0.041666666666666664,
    "false_rejection_count": 16.0,
    "frr": 0.08333333333333333,
    "initial_unresolved": 352.0,
    "irrelevant_activation": 64.0,
    "local_resolution": 288.0,
    "meta_signal_hard_veto": 0.0,
    "oracle_access_count": 0.0,
    "phase4_case_count": 25000.0,
    "phase4_frr": 0.23155597981726442,
    "phase4_original_escalation": 0.26488,
    "phase4_residual_escalation": 0.0,
    "phase4_rounds": 0.0,
    "phase4_uar": 0.0258370427714341,
    "phase4_world_count": 500.0,
    "query_count": 0.5833333333333334,
    "query_yield": 0.5833333333333334,
    "residual_escalation": 0.16666666666666666,
    "residual_escalation_count": 64.0,
    "rounds": 0.8333333333333334,
    "safe_total": 192.0,
    "scope_leakage": 0.0,
    "uar": 0.0,
    "uncertified_composition_influence": 0.0,
    "uncertified_terminal_count": 32.0,
    "unsafe_acceptance_count": 0.0,
    "unsafe_total": 192.0
  },
  "schema_version": "1.0.0",
  "status": "EXPECTED_DEGRADATION",
  "trace_hash": "8265af4340d228e4ccd283ae4d28767bf81ae695ef5d88ace650a1b385366afe"
}
