{
  "case_count": 192,
  "condition_id": "L4",
  "gate_results": {
    "execution_complete": true,
    "matched_budget": true,
    "preregistered_interpretation_passed": true,
    "single_factor_isolation": true
  },
  "group": "persistence_consolidation",
  "metrics": {
    "active_basis": 2.0,
    "active_basis_max": 2.0,
    "case_count": 192.0,
    "discovery_rounds": 0.0625,
    "frr": 0.0,
    "g1_memory_hit_rate": 0.875,
    "g1_rounds": 0.09375,
    "g1_scope_leakage": 0.0,
    "g2_memory_hit_rate": 0.9375,
    "g2_rounds": 0.296875,
    "g2_scope_leakage": 0.0,
    "g3_memory_hit_rate": 0.9583333333333334,
    "g3_rounds": 0.2708333333333333,
    "g3_scope_leakage": 0.0,
    "library_size": 12.0,
    "memory_hit_rate": 0.9375,
    "phase4_case_count": 25000.0,
    "phase4_frr": 0.025160234556116188,
    "phase4_original_escalation": 0.26488,
    "phase4_residual_escalation": 0.09564,
    "phase4_rounds": 0.16924,
    "phase4_uar": 0.19179407780143218,
    "phase4_world_count": 500.0,
    "quarantine_or_rollback": 16.0,
    "query_count": 0.19791666666666666,
    "query_yield": 0.921875,
    "redundancy": 0.0,
    "repeated_failed_paths": 15.0,
    "residual_escalation": 0.08333333333333333,
    "retrieval_cost": 1.9479166666666667,
    "rounds": 0.25,
    "scope_leakage": 0.0,
    "stale_scope_activation": 0.0,
    "synthesis_count": 3.0,
    "uar": 0.0
  },
  "schema_version": "1.0.0",
  "status": "EXPECTED_DEGRADATION",
  "trace_hash": "4ee726ed34eb4c7ffa700aa0681c0b3c2f06054dbb9c8035b550e868004e3ddc"
}
